[
  {
    "country": "South Africa",
    "provider_name": "WesBank Fleet Management and Leasing",
    "provider_type": "Bank-owned leasing provider",
    "confirmation_status": "Confirmed",
    "parent_company": "FirstRand / WesBank",
    "target_segment": "Business, corporate and fleet customers",
    "evidence_summary": "WesBank publishes fleet solutions covering fleet funding, procurement, fleet management and disposals, and a lease agreements page for business vehicles with maintenance options and full maintenance lease wording.",
    "sources": [
      "https://www.wesbank.co.za/home/fleet-solutions/",
      "https://www.wesbank.co.za/home/lease-agreements/"
    ],
    "confidence_level": "High",
    "notes_uncertainties": "Detailed product taxonomy to be captured in Phase 2."
  },
  {
    "country": "South Africa",
    "provider_name": "Standard Bank Fleet Management",
    "provider_type": "Bank-owned leasing provider",
    "confirmation_status": "Confirmed",
    "parent_company": "Standard Bank Group",
    "target_segment": "Business and corporate fleet customers",
    "evidence_summary": "Standard Bank publishes fleet management solutions including full maintenance rental, operating rental references, managed maintenance, Shari'ah fleet management and fleet cards.",
    "sources": [
      "https://www.standardbank.co.za/southafrica/business/products-and-services/business-solutions/fleet-management",
      "https://www.standardbank.co.za/southafrica/business/products-and-services/business-solutions/fleet-management/full-maintenance-rental"
    ],
    "confidence_level": "High",
    "notes_uncertainties": "Specific product variants and functionality will be separated in Phase 2 and Phase 3."
  },
  {
    "country": "South Africa",
    "provider_name": "Absa Vehicle Management Solutions",
    "provider_type": "Bank-owned leasing provider",
    "confirmation_status": "Confirmed",
    "parent_company": "Absa Group",
    "target_segment": "Business and fleet customers",
    "evidence_summary": "Absa discloses full maintenance leases, operating rentals and finance leases under its business vehicle and asset finance pages.",
    "sources": [
      "https://www.absa.co.za/business/funding-my-business/vehicle-and-asset-finance/explore/",
      "https://www.absa.co.za/business/funding-my-business/vehicle-and-asset-finance/absa-financial-lease/"
    ],
    "confidence_level": "High",
    "notes_uncertainties": "Product availability and naming should be confirmed against current brochures in Phase 2."
  },
  {
    "country": "South Africa",
    "provider_name": "Eqstra",
    "provider_type": "Fleet leasing provider",
    "confirmation_status": "Confirmed",
    "parent_company": "Nedbank",
    "target_segment": "Corporate, business and fleet customers",
    "evidence_summary": "Eqstra describes itself as a division of Nedbank and publishes full-maintenance leasing and fleet management services for South African fleets.",
    "sources": [
      "https://www.eqstra.co.za/",
      "https://www.eqstra.co.za/leasing",
      "https://group.nedbank.co.za/news-and-insights/press/2023/nedbank-acquires-100-percent-of-eqstra.html"
    ],
    "confidence_level": "High",
    "notes_uncertainties": "Nedbank/Eqstra brand architecture should be watched when comparing against NedFleet."
  },
  {
    "country": "South Africa",
    "provider_name": "Merchant West Fleet",
    "provider_type": "Independent leasing provider",
    "confirmation_status": "Confirmed",
    "parent_company": "Merchant West",
    "target_segment": "Business fleet customers",
    "evidence_summary": "Merchant West publishes fleet management, operating lease and full maintenance lease offerings for South African business fleets.",
    "sources": [
      "https://merchantwest.co.za/fleet/",
      "https://merchantwest.co.za/fleet/operating-lease/",
      "https://merchantwest.co.za/fleet/full-maintenance-lease-2/"
    ],
    "confidence_level": "High",
    "notes_uncertainties": "Ownership detail beyond Merchant West not expanded in Phase 1."
  },
  {
    "country": "South Africa",
    "provider_name": "Avis Fleet",
    "provider_type": "Fleet leasing provider",
    "confirmation_status": "Confirmed",
    "parent_company": "Zeda / Avis Southern Africa",
    "target_segment": "Corporate and enterprise fleet customers",
    "evidence_summary": "Avis Fleet publishes full maintenance lease, fleet management and telematics offerings, and describes end-to-end vehicle sourcing, financing, maintenance and disposal.",
    "sources": [
      "https://www.avisfleet.co.za/",
      "https://www.avisfleet.co.za/solutions/full-maintenance-lease",
      "https://www.avis.co.za/about-avis/group-companies"
    ],
    "confidence_level": "High",
    "notes_uncertainties": "Distinguish Avis Fleet from Avis Rent a Car in later product extraction."
  },
  {
    "country": "South Africa",
    "provider_name": "FleetAfrica",
    "provider_type": "Fleet leasing provider",
    "confirmation_status": "Confirmed",
    "parent_company": "Super Group Africa / Super Group",
    "target_segment": "Public sector, corporate and enterprise fleet customers",
    "evidence_summary": "FleetAfrica publishes specialised fleet management and full maintenance leasing solutions and identifies itself as a division of Super Group Africa.",
    "sources": [
      "https://fleetafrica.com/",
      "https://fleetafrica.com/fleet-solutions/",
      "https://fleetafrica.com/our-company/"
    ],
    "confidence_level": "High",
    "notes_uncertainties": "Claims such as '#1 provider' are treated as provider wording and require validation if used analytically."
  },
  {
    "country": "South Africa",
    "provider_name": "NedFleet",
    "provider_type": "Bank-owned leasing provider",
    "confirmation_status": "Confirmed",
    "parent_company": "Nedbank",
    "target_segment": "Fleet customers",
    "evidence_summary": "NedFleet public material states a specialty in full maintenance leasing and operating rentals; SAVRALA also lists NedFleet.",
    "sources": [
      "https://www.nedfleet.co.za/WebHelp/Introduction/Who_we_are.htm",
      "https://savrala.co.za/members/"
    ],
    "confidence_level": "Medium",
    "notes_uncertainties": "Requires validation because Nedbank acquired Eqstra and current brand/product overlap is unclear from public sources."
  },
  {
    "country": "South Africa",
    "provider_name": "Bidvest Bank Fleet Finance",
    "provider_type": "Bank-owned leasing provider",
    "confirmation_status": "Confirmed",
    "parent_company": "Bidvest Bank / Bidvest Group",
    "target_segment": "Business and fleet customers",
    "evidence_summary": "Bidvest Bank publishes fleet finance and fleet services including full maintenance lease-style finance where vehicles and related services are bundled.",
    "sources": [
      "https://www.bidvestbank.co.za/fleet-services/fleet-finance",
      "https://www.bidvestbank.co.za/fleet-services",
      "https://savrala.co.za/members/"
    ],
    "confidence_level": "High",
    "notes_uncertainties": "Phase 2 should distinguish finance, fleet card and leasing products."
  },
  {
    "country": "South Africa",
    "provider_name": "CFAO Mobility Fleet Solutions",
    "provider_type": "Fleet leasing / mobility provider",
    "confirmation_status": "Confirmed",
    "parent_company": "CFAO Mobility",
    "target_segment": "Business and fleet customers",
    "evidence_summary": "CFAO Mobility publishes South African fleet solutions with buy, lease or rent options, flexible leasing and finance, maintenance and servicing plans.",
    "sources": [
      "https://www.cfaomobility.co.za/fleet-solutions/"
    ],
    "confidence_level": "High",
    "notes_uncertainties": "Phase 2 should confirm whether CFAO acts as provider, dealer-channel arranger, or both."
  },
  {
    "country": "South Africa",
    "provider_name": "Pace Fleet Services",
    "provider_type": "Subscription-based vehicle leasing provider",
    "confirmation_status": "Confirmed",
    "parent_company": "Pace",
    "target_segment": "Businesses and owner-operator drivers",
    "evidence_summary": "Pace Fleet Services describes itself as a South African car leasing company offering subscription-based vehicle leasing and fully maintained vehicle fleets.",
    "sources": [
      "https://pacefleet.co.za/"
    ],
    "confidence_level": "High",
    "notes_uncertainties": "Owner-operator model should be treated separately from conventional corporate fleet leasing."
  },
  {
    "country": "South Africa",
    "provider_name": "Avis iLease",
    "provider_type": "Lease-like vehicle subscription provider",
    "confirmation_status": "Confirmed",
    "parent_company": "Avis / Zeda ecosystem",
    "target_segment": "Consumers, professionals and SMEs",
    "evidence_summary": "Avis iLease publishes flexible monthly car leasing offers in South Africa with lease-style monthly pricing.",
    "sources": [
      "https://www.avisilease.co.za/"
    ],
    "confidence_level": "High",
    "notes_uncertainties": "Relationship to Avis Fleet and Avis Rent a Car should be separated during product extraction."
  },
  {
    "country": "South Africa",
    "provider_name": "Imperial Truck Rental",
    "provider_type": "Commercial vehicle full-maintenance lease provider",
    "confirmation_status": "Confirmed",
    "parent_company": "Imperial / Motus group relationship requires validation",
    "target_segment": "Commercial truck and logistics fleet customers",
    "evidence_summary": "Imperial Truck Rental publishes full maintenance offerings with rental periods from 24 to 60 months, fleet management technology, maintenance scheduling, accident assistance and breakdown management.",
    "sources": [
      "https://www.imperialtruckrental.co.za/full-maintenance/"
    ],
    "confidence_level": "High",
    "notes_uncertainties": "Parent-company detail should be validated during provider profiling."
  },
  {